{
  "schema": "commitwork.feature-charter/1",
  "note": "The charter and the class assignment the featureset census reads. Declared, not inferred: bin/feature-census.mjs refuses to guess, so a (surface, key) pair absent from `groups` below is reported `unclassified` rather than quietly filed as core. Change this file to change a verdict, and the census output records which charter version it read.",
  "charterVersion": "2026-10-07.1",
  "charter": [
    "commitwork runs a repository's GitHub Actions CI locally, then scans that repository for security defects with a portable baseline of third-party and own-built checks.",
    "It runs that baseline on a schedule over a fleet of repositories, keeps the per-finding history, and reports what each check actually measured — including what it could not measure.",
    "It turns those findings into remediation work: a per-area queue, an issue tracker, suggested fixes a person approves, and an adjudication record of what was judged and why.",
    "It packages the same evidence for compliance audiences (EU CRA, SOC 2, NIST 800-53) and exposes it to coding agents over MCP.",
    "Its promise is reporting that survives scrutiny: a result it did not measure is never published as a pass, and never as a finding."
  ],
  "membershipTests": {
    "core": "Delete this group and a sentence of the charter above becomes false. Mechanically: the group is named in `charter`, and some other core group reads its output.",
    "extension": "Builds on a core group through a public seam (a route, a store, a manifest), is complete on the inventory's own fields (entry point + tests + docs), and could be removed without editing any core group.",
    "ring-outward": "Serves an adjacent audience or an adjacent job. No core group reads its output, so removing it changes who commitwork is for, not whether it works.",
    "fragment": "Reachable, but the inventory shows a completeness field missing: no test names it, no doc names it, or (a panel view) it has no durable URL. A decision, never a deletion.",
    "orphan": "Defined in the tree and wired into nothing that runs: an unmounted route table, a view no chrome links to, a descriptor with no handler, a module nothing names, an override nothing reads outside tests."
  },
  "classPriority": ["orphan", "fragment", "declared"],
  "priorityNote": "orphan and fragment are MECHANICAL and outrank the declared class, because a group can be core in intent and still have an entry point nothing reaches. The declared class is what the group WOULD be once complete, and the census records both so the disposition is legible.",
  "censusPopulation": ["cli-command", "cli-script", "http-route", "ui-view", "mcp-tool", "job", "package-api"],
  "populationNote": "config-flag is inventoried but NOT censused: an environment override is a parameter OF a feature, not a feature. Classing 626 of them would put 90% of the census rows on things no reader calls a feature, and the per-flag documentation gap is reported as its own count instead.",
  "experimentalNote": "Every ring-outward group carries \"experimental\": true and a \"flag\" id from experimentalFlags. A flag is ON unless switched off: the panel Settings view (Experimental features, POST /api/features), the experimentalFeatures setting, CW_FEATURE_<ID>=on|off for one flag (dashes become underscores, uppercased), or CW_EXPERIMENTAL=on|off for all. Per-flag env beats CW_EXPERIMENTAL, which beats the store. An off flag is refused by the route dispatcher (404), hidden from panel navigation, listed under 'experimental (off)' in CLI help and refused when run, omitted from the MCP tool list and refused when called, and not installed by monitor/install-agents.mjs. cli-script groups have no runtime gate: the flag is recorded and the census reports it unenforced. A flag may also be declared with no group and optional \"views\" (panel view ids): it is gated in code through featureEnabled()/gateFeature() and needs no other declaration. lib/feature-charter.mjs reads this declaration; lib/feature-flags.mjs resolves it.",
  "experimentalFlags": {
    "scan-images": { "label": "Container image scan", "why": "commitwork scan-images: a Trivy scan of this host's images, not of a repository" },
    "npm-updates": { "label": "npm dependency updates", "why": "commitwork deps --update writes proposal branches into the repository it audits, and with --merge moves that repository's branch" },
    "flow": { "label": "Dataflow lexer", "why": "flow/ scripts for an adjacent language lane" },
    "map": { "label": "Modernisation map engine", "why": "map/ scripts; renders no data without a private map/data/<slug>" },
    "sitemap": { "label": "Site map harvest", "why": "sitemap/ scripts and the daily sitemap-data job" },
    "chunk-diff": { "label": "Chunk diff utility", "why": "chunk-diff/ scripts" },
    "commitwork-web": { "label": "Marketing site build", "why": "commitwork-web/ scripts" },
    "lanes-quality": { "label": "Quality views", "why": "accessibility, unfinished code, hard-to-read code and comment-quality views: readability, not security" },
    "lanes-lint": { "label": "Lint views", "why": "linter lanes; a finding never reaches the security headline" },
    "lanes-types": { "label": "Type-check views", "why": "type-checker lanes" },
    "codegraph-mcp": { "label": "Code map MCP tools", "why": "code_about, code_blast_radius and code_dead_exports" },
    "turns-mcp": { "label": "Transcript grading MCP tool", "why": "turn_efficiency reads local agent transcripts" },
    "offbox": { "label": "Off-box attestation", "why": "off-host pages, their ingest and the two offbox jobs; needs a second host" },
    "docsite": { "label": "Document site", "why": "docsite authoring, editor and publishing; deploys to a Cloudflare account" },
    "agents": { "label": "Agent controls", "why": "agent dispatch and follow-ups, local model runtime, transcript grading, comment review and learning mode routes" },
    "launchlist": { "label": "Launch checklist", "why": "the publication-readiness board" },
    "memory-view": { "label": "Memory record viewer", "why": "memory-view routes; not mounted today" },
    "feed": { "label": "Findings feed", "why": "admin/routes/feed.mjs and admin/static/panel-feed.js: one grouped feed over the project rollup joined to the issue store, beside the per-check tabs it does not replace yet", "views": ["feed"] },
    "palette": { "label": "Command palette", "why": "admin/routes/palette.mjs and admin/static/panel-palette.js: Cmd/Ctrl+K search over views, checks, projects and actions, plus G-then-key chords" },
    "journey": { "label": "Guided setup", "why": "admin/routes/journey.mjs and admin/static/panel-journey.js: the nine-step setup checklist whose state is read from the records each step is about", "views": ["journey"] },
    "inbox": { "label": "Inbox", "why": "admin/routes/inbox.mjs, monitor/inbox.mjs and admin/static/panel-inbox.js: what changed in one area since its last sweep, with per-operator read and snooze state", "views": ["inbox"] },
    "pull-request": { "label": "Create pull request", "why": "admin/routes/pull-request.mjs and bin/create-pr.mjs: push a registered repository's HEAD to a commitwork/ branch and open a pull request from the feed; operator port only, and merging stays human" }
  },
  "groups": [
    { "id": "cli.run", "surface": "cli-command", "keys": ["run", "list", "doctor"], "class": "core", "why": "running a repo's CI locally against a manifest is the first sentence of the charter" },
    { "id": "cli.scan", "surface": "cli-command", "keys": ["scan", "reindex"], "class": "core", "why": "the portable security baseline and the report index it writes; every other surface reads its output" },
    { "id": "cli.help", "surface": "cli-command", "keys": ["help"], "class": "core", "why": "a CLI with no usage output has no entry point for a first-time reader" },
    { "id": "cli.brief", "surface": "cli-command", "keys": ["brief"], "class": "core", "why": "scans a repository or a directory of them and ranks what to fix" },
    { "id": "cli.deps", "surface": "cli-command", "keys": ["deps"], "class": "ring-outward", "experimental": true, "flag": "npm-updates", "why": "keeping a scanned repository's npm dependencies current is an adjacent job: it proposes and merges updates there, and no core group reads its output" },
    { "id": "cli.setup", "surface": "cli-command", "keys": ["setup"], "class": "extension", "why": "installs the scanners through the host package manager; the baseline runs without it, reporting the missing tools as unmeasured" },
    { "id": "cli.scan-images", "surface": "cli-command", "keys": ["scan-images"], "class": "ring-outward", "experimental": true, "flag": "scan-images", "why": "container images on this host are an adjacent subject: no repository scan reads its output" },

    { "id": "scripts.bin", "surface": "cli-script", "keys": ["bin"], "class": "core", "why": "the runner, the scanners' own one-shot tools, the gates and the test harness" },
    { "id": "scripts.monitor", "surface": "cli-script", "keys": ["monitor"], "class": "core", "why": "the scheduled fleet sweep, the registry and the rollup — the second and third charter sentences" },
    { "id": "scripts.admin", "surface": "cli-script", "keys": ["admin"], "class": "extension", "why": "the panel server and its build; the CLI and the sweep run without it" },
    { "id": "scripts.cra", "surface": "cli-script", "keys": ["cra"], "class": "extension", "why": "compliance packaging over the same findings store, through its public seam" },
    { "id": "scripts.mcp", "surface": "cli-script", "keys": ["mcp"], "class": "extension", "why": "an agent-facing read surface over the existing evidence" },
    { "id": "scripts.codegraph", "surface": "cli-script", "keys": ["codegraph"], "class": "extension", "why": "a module map of this repository, consumed by the MCP code_* tools" },